_input,_num,_widgetName,_source,_resultNumber,_pageUrl,name,url,url/_source,url/_title,url/_text,description
,84,sig-crawler,sig-crawler,84,http://votesmart.org/interest-group/1904/catholic-families-usa,Catholic Families USA,http://catholicfamiliesusa.org/,,,http://catholicfamiliesusa.org/,Catholic Families for America has six core goals:  Influence public policy by promoting family-friendly policies on every issue from abortion to education to the deterioration of the family.  Become the largest grassroots organization for Catholics who are tired of liberals hijacking our Faith for nefarious ends.  Promote authentic Catholic teaching in the public square supporting the Holy Father our bishops and our priests when they take courageous stands on crucial issues.  Hold Catholic officials accountable to Church teaching.  Publicly support our bishops who admonish those officials for their voting records and proposals.  Raise the consciousness of issues as well as comfort with political activity by hosting family conferences and retreats each year.
,85,sig-crawler,sig-crawler,85,http://votesmart.org/interest-group/1936/voices-for-creative-nonviolence,Voices for Creative Nonviolence,http://vcnv.org/,,,http://vcnv.org/,"Voices for Creative Nonviolence has deep long-standing roots in active nonviolent resistance to U.S. war-making. Begun in the summer of 2005 Voices draws upon the experiences of those who challenged the brutal economic sanctions imposed by the U.S. and U.N. against the Iraqi people between 1990 and 2003."
,86,sig-crawler,sig-crawler,86,http://votesmart.org/interest-group/1181/mennonite-central-committee,Mennonite Central Committee,http://www.mcc.org/,,,http://www.mcc.org/,"Mennonite Central Committee seeks to demonstrate God's love by working among people suffering from poverty conflict oppression and natural disaster. MCC serves as a channel for interchange by building mutually transformative relationships. MCC strives for peace justice and the dignity of all people by sharing our experiences resources and faith in Jesus Christ."
,87,sig-crawler,sig-crawler,87,http://votesmart.org/interest-group/873/american-federation-of-teachers,American Federation of Teachers,http://www.aft.org/,,,http://www.aft.org/,"The mission of the American Federation of Teachers AFL-CIO is to improve the lives of our members and their families; to give voice to their legitimate professional economic and social aspirations; to strengthen the institutions in which we work; to improve the quality of the services we provide; to bring together all members to assist and support one another; and to promote democracy human rights and freedom in our union in our nation and throughout the world."
,88,sig-crawler,sig-crawler,88,http://votesmart.org/interest-group/83/communications-workers-of-america,Communications Workers of America,http://www.cwa-union.org/,,,http://www.cwa-union.org/,"CWA the largest telecommunications union in the world represents over 700000 men and women in both private and public sectors including over half a million workers who are building the Information Highway."
,89,sig-crawler,sig-crawler,89,http://votesmart.org/interest-group/2407/national-association-of-police-organizations,National Association of Police Organizations,http://www.napo.org/,,,http://www.napo.org/,"The National Association of Police Organizations (NAPO) is a coalition of police units and associations from across the United States. NAPO was organized for the purpose of advancing the interests of Americas law enforcement officers through legislative advocacy political action and education. Increasingly the rights and interests of law enforcement officers have been the subject of legislative executive and judicial action in the nations capital. From issues of federal funding of State law enforcement and anti-terrorism efforts to federal policy on employee health pensions and other benefits the actions of Congress and the Administration significantly impact public safety interests. These interests must be vigorously protected in light of the vital role law enforcement officers play in maintaining the peace and security of American society. NAPO works to influence the course of national affairs where law enforcement interests are concerned."
,90,sig-crawler,sig-crawler,90,http://votesmart.org/interest-group/2334/united-mine-workers-of-america,United Mine Workers of America,http://www.umwa.org/index.php,,,http://www.umwa.org/index.php,"The United Mine Workers of America is a growing union with a diverse membership that includes coal miners clean coal technicians health care workers truck drivers manufacturing workers and public employees throughout the United States and Canada. In the face of an unrelentingly hostile environment for union organizing in the United States the UMWA is achieving significant success in providing workers with a voice on the job and financial security at home. The international union today continues the fight we began in 1890 for safe workplaces good wages and benefits and fair representation in workplaces throughout North America. "
,91,sig-crawler,sig-crawler,91,http://votesmart.org/interest-group/1932/aids-drug-assistance-program-adap-advocacy-association,AIDS Drug Assistance Program (ADAP) Advocacy Association,http://www.adapadvocacyassociation.org/,,,http://www.adapadvocacyassociation.org/,The ADAP Advocacy Association (aaa+) is a national 501(c)(3) nonprofit organization incorporated in the District of Columbia to promote and enhance the AIDS Drug Assistance Programs (ADAPs) and improve access to care for persons living with HIV/AIDS. aaa+ works with advocates community health care government patients pharmaceutical companies and other stakeholders to assure that access to services recognize and afford persons living with HIV/AIDS to enjoy a healthy life.
,92,sig-crawler,sig-crawler,92,http://votesmart.org/interest-group/504/national-association-of-manufacturers,National Association of Manufacturers,http://www.nam.org,,,http://www.nam.org,"The mission of the NAM is to be the voice for all manufacturing in the United States. To inform legislators the Administration the media policy influencers and the public about manufacturings vital leadership in innovation job opportunity technological progress and economic security. We are a respected and focused partner in achieving an economic environment that encourages the expansion of manufacturing in the United States and strengthens our global leadership."
,93,sig-crawler,sig-crawler,93,http://votesmart.org/interest-group/1868/national-journal,National Journal,http://www.nationaljournal.com/,,,http://www.nationaljournal.com/,"Regarded as the most credible objective and authoritative voice in the Beltway National Journal has been Washingtons premier source of nonpartisan insight on politics and policy for more than four decades. A significant re-launch in Fall 2010 enhanced this unparalleled reputation for intelligence and depth with energy currency and speed."
,94,sig-crawler,sig-crawler,94,http://votesmart.org/interest-group/2406/gun-sense,Gun Sense,https://gunsensevoter.org/,,,https://gunsensevoter.org/,"Gun Sense is the simple idea that we can do more to keep our families and communities safe from gun violence. Its the belief that we as Americans dont have to tolerate 31000 deaths from gun violence every year. If you believe that felons and domestic abusers shouldnt have access to guns; if you think guns dont belong in places like churches schools and playgrounds; If you think our elected officials should be as passionate about the safety of our communities as they are about the right to bear arms: You have Gun Sense."
,95,sig-crawler,sig-crawler,95,http://votesmart.org/interest-group/758/international-sleep-products-association,International Sleep Products Association,http://www.sleepproducts.org/,,,http://www.sleepproducts.org/,ISPA was formed in 1915 by 39 bedding manufacturers to accomplish the following key objectives: Encourage uniformity in industry standards and government regulations Elevate the image of the industry and its products Disseminate vital information Fight for members common interests Bring the members of the industry together
,96,sig-crawler,sig-crawler,96,http://votesmart.org/interest-group/1703/national-association-for-addiction-professionals-formerly-national-association-of-alcohol-and-drug-abuse-counselors,National Association for Addiction Professionals (formerly National Association of Alcohol and Drug Abuse Counselors),http://www.naadac.org,,,http://www.naadac.org,NAADAC's Mission is to lead unify and empower addiction focused professionals to achieve excellence through education advocacy knowledge standards of practice ethics professional development and research.
,97,sig-crawler,sig-crawler,97,http://votesmart.org/interest-group/935/common-cause,Common Cause,http://www.commoncause.org/,,,http://www.commoncause.org/,"Common Cause is a nonpartisan nonprofit advocacy organization founded in 1970 by John Gardner as a vehicle for citizens to make their voices heard in the political process and to hold their elected leaders accountable to the public interest. " Common Cause seeks by sustained and focused lobbying campaigns grassroots activities and other efforts: To strengthen public participation and public faith in our institutions of self-government: To ensure that government and the political process serve the general interest rather than special interest: To curb the excessive influence of money on government decisions and elections: To promote fair and honest elections and high ethical standards for government officials: and to protect the civil rights and civil liberties of all Americans."
,98,sig-crawler,sig-crawler,98,http://votesmart.org/interest-group/1120/national-farmers-union,National Farmers Union,http://www.nfu.org/,,,http://www.nfu.org/,National Farmers Union was founded in 1902 in Point Texas to help the family farmer address profitability issues and monopolistic practices. NFU has been working since 1902 to protect and enhance the economic well-being and quality of life for family farmers ranchers and rural communities through advocating grassroots-driven policy positions adopted by its membership.
,99,sig-crawler,sig-crawler,99,http://votesmart.org/interest-group/2199/government-is-not-god-political-action-committee-ging-pac,Government is Not God Political Action Committee (GING-PAC),http://www.gingpac.org,,,http://www.gingpac.org,GING-PAC is a true social conservative political action committee. GING-PAC can do more than educate people about the candidates  much more. GING-PAC can donate money directly to social conservative candidates for their campaigns. GING-PAC can also run independent radio TV and newspaper ads favoring socially conservative candidates and with no financial limitations! GING-PAC stands for Government Is Not God Political Action Committee. The name says it all. We support candidates who believe God is God and the Government should never try to be!
,100,sig-crawler,sig-crawler,100,http://votesmart.org/interest-group/2339/women-under-forty-political-action-committee,Women Under Forty Political Action Committee,http://www.wufpac.org/,,,http://www.wufpac.org/,"WUFPAC is a nonpartisan political action committee that supports women forty years of age and under running for state and federal public office at the time of endorsement. WUFPACs mission is twofold: To help elect more young women to elected office so that young women have an equal voice in shaping public policy. To build the seniority of women in Congress by electing women at a young age. WUFPAC was started in January 1999 by a group of young women representing diverse political and geographic backgrounds gathered together in Washington DC to discuss the role of young women in politics. Recognizing that political capital is built by political tenure and frustrated by the low percentage of women currently holding political office they created WUFPAC to support the efforts of young women running for Congress and statewide offices. WUFPAC was incorporated as a Washington DC non-profit corporation in January 1999 and filed its statement of organization with the Federal Election Commission soon thereafter. The first WUFPAC executive board was assembled in the early months of 1999. WUFPAC has been active in political cycles since 2002."
,101,sig-crawler,sig-crawler,101,http://votesmart.org/interest-group/1974/keep-america-safe,Keep America Safe,http://www.keepamericasafe.com/,,,http://www.keepamericasafe.com/,"The mission of Keep America Safe is to provide information for concerned Americans about critical national security issues. Keep America Safe seeks to influence public policy by encouraging dialogue between American citizens and their elected representatives in order to produce legislation and executive action that enhances the national security of the United States." This organization was dissolved in 2013. Its archives are kept here as a public service. - Project Vote Smart
,102,sig-crawler,sig-crawler,102,http://votesmart.org/interest-group/1347/bakery-confectionery-tobacco-workers-and-grain-millers,Bakery Confectionery Tobacco Workers and Grain Millers,http://www.bctgm.org,,,http://www.bctgm.org,"The Bakery Confectionery Tobacco Workers and Grain Millers (BCTGM) International Union is a modern union with old-fashioned values. We are dedicated to giving workers in our industries a voice and a vote in their workplace. We believe that all workers should be treated with Dignity Justice and Respect on the job."
,103,sig-crawler,sig-crawler,103,http://votesmart.org/interest-group/1918/cnet-news,CNET News,http://news.cnet.com/,,,http://news.cnet.com/,"CNET shows you the exciting possibilities of how technology can enhance and enrich your life. We provide you with information tools and advice that help you decide what to buy and how to get the most out of your tech."
,104,sig-crawler,sig-crawler,104,http://votesmart.org/interest-group/1497/american-family-association,American Family Association,http://www.afa.net,,,http://www.afa.net,"The mission of the American Family Association is to inform equip and activate individuals to strengthen the moral foundations of American culture and give aid to the church here and abroad in its task of fulfilling the Great Commission. "
,105,sig-crawler,sig-crawler,105,http://votesmart.org/interest-group/933/national-federation-of-independent-business,National Federation of Independent Business,http://www.nfib.com,,,http://www.nfib.com,NFIBs mission is to promote and protect your right to own operate and grow your business.
,106,sig-crawler,sig-crawler,106,http://votesmart.org/interest-group/1059/league-of-united-latin-american-citizens,League of United Latin American Citizens,http://www.lulac.org/,,,http://www.lulac.org/,"The Mission of the League of United Latin American Citizens is to advance the economic condition educational attainment political influence health and civil rights of the Hispanic population of the United States."
,107,sig-crawler,sig-crawler,107,http://votesmart.org/interest-group/544/united-states-border-control,United States Border Control,http://www.usbc.org,,,http://www.usbc.org,"U.S. Border Control is a non-profit tax-exempt citizens lobby headquartered in Washington D.C. Border Control is dedicated to ending illegal immigration by securing our nation's borders and reforming our border and immigration policies. Our organization receives no financial support from any branch of government. All our support comes from concerned citizens who appreciate the work we are doing and wish to see it continue."
,108,sig-crawler,sig-crawler,108,http://votesmart.org/interest-group/1074/international-brotherhood-of-electrical-workers,International Brotherhood of Electrical Workers,http://www.ibew.org,,,http://www.ibew.org,The International Brotherhood of Electrical Workers (IBEW) represents approximately 750000 active members and retirees who work in a wide variety of fields including utilities construction telecommunications broadcasting manufacturing railroads and government. The IBEW has members in both the United States and Canada and stands out among the American unions in the AFL-CIO because it is among the largest and has members in so many skilled occupations.
,109,sig-crawler,sig-crawler,109,http://votesmart.org/interest-group/1919/can-do-conservatives,Can Do Conservatives,,,,,This organization was dissolved. Its archives are kept here as a public service. "The Can-Do Conservatives of America is the nations first Conservative political organization representing Americans with disabilities. We are dedicated to giving Americans with disabilities a voice in the Conservative movement advocating for policies that will put an end to the vicious cycle of government dependence and supporting Conservative candidates that support these policies and will fight to carry them out."
,110,sig-crawler,sig-crawler,110,http://votesmart.org/interest-group/2181/move-to-amend,Move to Amend,https://movetoamend.org/,,,https://movetoamend.org/,On January 21 2010 with its ruling in Citizens United v. Federal Election Commission the Supreme Court ruled that corporations are persons entitled by the U.S. Constitution to buy elections and run our government. Human beings are people; corporations are legal fictions. We the People of the United States of America reject the U.S. Supreme Court's ruling in Citizens United and other related cases and move to amend our Constitution to firmly establish that money is not speech and that human beings not corporations are persons entitled to constitutional rights.
,111,sig-crawler,sig-crawler,111,http://votesmart.org/interest-group/1705/national-council-of-agricultural-employers,National Council of Agricultural Employers,http://www.ncaeonline.org,,,http://www.ncaeonline.org,"NCAE is the ONLY national association focusing exclusively on farm labor issues from the farm management viewpoint. Formed as a non-profit organization in 1964 NCAE represents your interests before Congress on critical farm labor issues and works closely with the Immigration and Naturalization Service the Departments of Labor and Agriculture the Occupational Safety and Health Administration and the Environmental Protection Agency."
,112,sig-crawler,sig-crawler,112,http://votesmart.org/interest-group/2243/voices-of-conservative-women,Voices of Conservative Women,http://voicesofconservativewomen.org/,,,http://voicesofconservativewomen.org/,"VOICES of Conservative Women was formed in late 2009 as a nonpartisan State Political Action Committee (VOICESPAC) in Minnesota. Our focus is on promoting fiscal responsibility limited government and free-market principles. The goal was to not only give direct financial support to candidates but raise money from our supporters to promote our core values: fiscal responsibility limited government and free market principles. In addition to donating funds to candidates VOICESPAC would aggressively campaign to elect our endorsed candidate through independent expenditures especially in competitive races at all levels of government."
,113,sig-crawler,sig-crawler,113,http://votesmart.org/interest-group/1922/american-hospital-association,American Hospital Association,http://www.aha.org/aha_app/index.jsp,,,http://www.aha.org/aha_app/index.jsp,To advance the health of individuals and communities. The AHA leads represents and serves hospitals health systems and other related organizations that are accountable to the community and committed to health improvement.
,114,sig-crawler,sig-crawler,114,http://votesmart.org/interest-group/1855/the-public-affairs-alliance-of-iranian-americans,The Public Affairs Alliance of Iranian Americans,http://www.paaia.org/,,,http://www.paaia.org/,The Public Affairs Alliance of Iranian Americans PAAIA Inc. is a nonprofit nonpartisan nonreligious 501(c)(4) membership organization that serves the domestic interests of Iranian Americans and represents the community before U.S. policymakers and the American public at large. PAAIA works to foster greater understanding of our community and its cultural heritage and to expand opportunities for the active participation of Iranian Americans in the democratic process at all levels of government.
,115,sig-crawler,sig-crawler,115,http://votesmart.org/interest-group/1966/liberty-central,Liberty Central,http://www.libertycentral.org/,,,http://www.libertycentral.org/,"Liberty Central is a non-partisan 501(c)(4) nonprofit organization located near Washington D.C. staffed and managed by seasoned patriotic activists who have enjoyed a huge track-record of success. We owe no party our allegiance and recognize the value of working within a two-party system."
,116,sig-crawler,sig-crawler,116,http://votesmart.org/interest-group/1757/teachers-of-english-to-speakers-of-other-languages-tesol,Teachers of English to Speakers of Other Languages (TESOL),http://www.tesol.org,,,http://www.tesol.org,TESOL International Associations mission is to advance professional expertise in English language teaching and learning for speakers of other languages worldwide.
,117,sig-crawler,sig-crawler,117,http://votesmart.org/interest-group/1012/league-of-conservation-voters,League of Conservation Voters,http://www.lcv.org/,,,http://www.lcv.org/,"The League of Conservation Voters (LCV) is a national non-profit organization that works to turn environmental values into national priorities. To secure the environmental future of our planet LCV advocates for sound environmental policies elects pro-environment candidates who will adopt and implement such policies provides the state LCVs with the resources and tools to accomplish and sustain their mission. * Through our National Environmental Scorecard and Presidential Report Card we inform the public about the most important environmental legislation of the past Congressional session and show them how their own and other representatives voted. * We run tough and effective campaigns to defeat anti-environment candidates and support those leaders who stand up for a clean healthy future for America. * We educate the public build coalitions promote grassroots power and train the next generation of environmental leaders as part of our grassroots efforts."
,118,sig-crawler,sig-crawler,118,http://votesmart.org/interest-group/527/american-bar-association,American Bar Association,http://www.americanbar.org/aba.html,,,http://www.americanbar.org/aba.html,"The American Bar Association is one of the worlds largest voluntary professional organizations with nearly 400000 members and more than 3500 entities. It is committed to doing what only a national association of attorneys can do: serving our members improving the legal profession eliminating bias and enhancing diversity and advancing the rule of law throughout the United States and around the world."
,119,sig-crawler,sig-crawler,119,http://votesmart.org/interest-group/2056/united-farm-workers-of-america,United Farm Workers of America,http://www.ufw.org/,,,http://www.ufw.org/,"Founded in 1962 by Cesar Chavez the United Farm Workers of America is the nation's first successful and largest farm workers union currently active in 10 states. The UFW continues to organize in major agricultural industries across the nation. [...] The UFW is also pushing its historic bipartisan and broadly backed AgJobs immigration reform bill."
,120,sig-crawler,sig-crawler,120,http://votesmart.org/interest-group/1714/academy-of-general-dentistry,Academy of General Dentistry,http://www.agd.org,,,http://www.agd.org,"The mission of the AGD is to serve the needs and represent the interests of general dentists to promote the oral health of the public and to foster continued proficiency of general dentists through quality continuing dental education in order to better serve the public."
,121,sig-crawler,sig-crawler,121,http://votesmart.org/interest-group/1715/iranian-american-political-action-committee,Iranian American Political Action Committee,http://www.iranianamericanpac.org,,,http://www.iranianamericanpac.org,"The mission of the Iranian American Political Action Committee is: *To support and promote the election of candidates for federal state and local office regardless of party affiliation who are attuned to the domestic needs and issues of the Iranian American community *To support and promote Iranian American candidates for public office *To support and advance legislation as it affects the concerns of the Iranian American community *To encourage Iranian Americans to actively participate in the American electoral process."
,122,sig-crawler,sig-crawler,122,http://votesmart.org/interest-group/1359/campaign-for-americas-future,Campaign for America's Future,http://www.ourfuture.org/,,,http://www.ourfuture.org/,"The Campaign for Americas Future is the strategy center for the progressive movement. Our goal is to forge the enduring progressive majority needed to realize the America of shared prosperity and equal opportunity that our country was meant to be."
,123,sig-crawler,sig-crawler,123,http://votesmart.org/interest-group/1086/campaign-for-working-families,Campaign for Working Families,http://www.cwfpac.com/,,,http://www.cwfpac.com/,"CWF has used its resources to raise public awareness of partial-birth abortion through extensive media campaigns and distributed two million pieces of literature through our voter education program."
