_input,_num,_widgetName,_source,_resultNumber,_pageUrl,name,url,url/_source,url/_title,url/_text,description
,1,sig-crawler,sig-crawler,1,http://votesmart.org/interest-group/956/national-council-of-la-raza,National Council of La Raza,http://www.nclr.org/,,,http://www.nclr.org/,The National Council of La Raza (NCLR)the largest national Hispanic civil rights and advocacy organization in the United Statesworks to improve opportunities for Hispanic Americans. Through its network of nearly 300 affiliated community-based organizations NCLR reaches millions of Hispanics each year in 41 states Puerto Rico and the District of Columbia. To achieve its mission NCLR conducts applied research policy analysis and advocacy providing a Latino perspective in five key areasassets/investments civil rights/immigration education employment and economic status and health. In addition it provides capacity-building assistance to its Affiliates who work at the state and local level to advance opportunities for individuals and families.
,2,sig-crawler,sig-crawler,2,http://votesmart.org/interest-group/1669/national-association-of-elementary-school-principals,National Association of Elementary School Principals,http://www.naesp.org/,,,http://www.naesp.org/,The NAESP Foundation advances excellence innovation and equity in schools by endowing leadership and learning for principals for the benefit of all children.
,3,sig-crawler,sig-crawler,3,http://votesmart.org/interest-group/2155/term-limits-america-political-action-committee,Term Limits America Political Action Committee,http://termlimits.org/,,,http://termlimits.org/,"Term Limits is still known as the largest grassroots movement in American history and US Term Limits (USTL) was and still is the leader of that movement. Term limits have been placed on 15 state legislatures eight of the ten largest cities in America adopted term limits for their city councils and/or mayor and 37 states place term limits on their constitutional officers. American politicians special interests and lobbyists continue to combat term limits as they know term limits force out career politicians who are more concerned with their own gain than the interests of the American people. USTL stands up against this practice. We are the voice of the American citizen. We want a government of the people by the people and for the people not a tyrannical ruling class who care more about deals to benefit themselves than their constituents."
,4,sig-crawler,sig-crawler,4,http://votesmart.org/interest-group/1811/grassroots-netroots-alliance,Grassroots Netroots Alliance,http://grassrootsnetroots.org,,,http://grassrootsnetroots.org,"The GNA is a new nationwide effort to build up a netroots and grassroots army of millions of radical but practical-minded voters and activists."
,5,sig-crawler,sig-crawler,5,http://votesmart.org/interest-group/651/federation-of-american-societies-for-experimental-biology,Federation of American Societies for Experimental Biology,http://www.faseb.org/,,,http://www.faseb.org/,Advance health and welfare by promoting progress and education in biological and biomedical sciences through service to our member societies and collaborative advocacy.
,6,sig-crawler,sig-crawler,6,http://votesmart.org/interest-group/989/national-stone-sand-gravel-association,National Stone Sand & Gravel Association,http://www.nssga.org,,,http://www.nssga.org,"The National Stone Sand and Gravel Association represents the crushed stone sand and gravel--or aggregate--industries. Our members account for 90% of the crushed stone and 70% of the sand and gravel produced annually in the United States. More than three billion tons of aggregate were produced in the U.S. in 2001 at a value of approximately $14.5 billion."
,7,sig-crawler,sig-crawler,7,http://votesmart.org/interest-group/2333/blue-dog-coalition,Blue Dog Coalition,http://bluedogdems.ngpvanhost.com/,,,http://bluedogdems.ngpvanhost.com/,"The Blue Dog Coalition was created in 1995 to represent the commonsense middle of the Democratic Party. Blue Dogs advocate for mainstream American values a commitment to fiscal responsibility and a strong national defense. The name Blue Dog originates from the long-time tradition of referring to a strong Democratic Party supporter as being a Yellow Dog Democrat who would vote for a yellow dog if it was listed on the ballot as a Democrat. Leading up to the 1994 election the founding members of the Blue Dogs felt that they had been choked blue by the extremes of both political parties. "
,8,sig-crawler,sig-crawler,8,http://votesmart.org/interest-group/1466/national-council-of-senior-citizens,National Council of Senior Citizens,,,,,"Organization of autonomous senior citizen groups which support Medicare Social Security national health care housing and other senior issues. Does advocacy on behalf of the elderly." The following ratings are based on the votes the organization considered most important; the numbers reflect the percentage of time the representative voted the organization's preferred position.
,9,sig-crawler,sig-crawler,9,http://votesmart.org/interest-group/1488/national-family-planning-reproductive-health-association,National Family Planning & Reproductive Health Association,http://www.nfprha.org,,,http://www.nfprha.org,"The National Family Planning and Reproductive Health Association (NFPRHA) founded in 1971 is a non-profit membership organization established to assure access to voluntary comprehensive and culturally sensitive family planning and reproductive health care services and to support reproductive freedom for all."
,10,sig-crawler,sig-crawler,10,http://votesmart.org/interest-group/233/financial-executives-international,Financial Executives International,http://www.financialexecutives.org,,,http://www.financialexecutives.org,"We strive to be the eyes and ears of the typical finance officer facing the day-to-day challenge of enhancing his or her shareholders' investment. We help members anticipate and react to change acquire new resources to enhance shareholder value and build the personal skills needed to further their careers. We do this by providing information through diverse forms of communication knowledge of evolving trends and issues and high-quality programs. We help to identify new opportunities for peer networking and provide for effective advocacy through representation before legislators and regulators."
,11,sig-crawler,sig-crawler,11,http://votesmart.org/interest-group/1292/united-to-end-genocide,United To End Genocide,http://endgenocide.org,,,http://endgenocide.org,United to End Genocide is dedicated to preventing and ending genocide and mass atrocities worldwide by building a powerful lasting movement of community activists faith leaders students artists investors and genocide survivors and all those who believe we must fulfill the promise the world made following the Holocaust: Never Again! The Save Darfur Coalition and the Genocide Intervention Network are now known as United to End Genocide.
,12,sig-crawler,sig-crawler,12,http://votesmart.org/interest-group/2183/the-center-for-education-reform,The Center for Education Reform,http://www.edreform.com/,,,http://www.edreform.com/,In the emerging landscape of education reform the Center for Education Reform is the leading voice for structural and sustainable changes that can dramatically improve educational opportunities for decades to come. Our guiding purpose is to improve the accuracy and quality of discourse and decisions about education reform leading to fundamental policy changes that make a difference long after news and election cycles have ended.
,13,sig-crawler,sig-crawler,13,http://votesmart.org/interest-group/1226/gun-owners-of-america,Gun Owners of America,http://www.gunowners.org,,,http://www.gunowners.org,"Gun Owners of America (GOA) is a non-profit lobbying organization formed in 1975 to preserve and defend the Second Amendment rights of gun owners. GOA sees firearms ownership as a freedom issue."
,14,sig-crawler,sig-crawler,14,http://votesmart.org/interest-group/1419/center-for-international-policy,Center for International Policy,http://www.ciponline.org,,,http://www.ciponline.org,"The Center for International Policy is a nonprofit research and advocacy organization based in Washington D.C. Through advocacy and policy research CIP promotes transparency and accountability in U.S. foreign policy and global relations. We advocate policies that advance international cooperation demilitarization respect for human rights and action to alleviate climate change and stop illicit financial flows. Our work provides policy recommendations and analysis to decision makers in government international organizations the private sector and civil society."
,15,sig-crawler,sig-crawler,15,http://votesmart.org/interest-group/1970/vote-kids,Vote Kids,http://www.votekids.org/,,,http://www.votekids.org/,"Vote Kids is a nonprofit organization 501(c)(4) organization devoted to making children a political priority  not a political afterthought and demanding that public officials support better policies for kids by mobilizing voters running campaigns spotlighting the voting records of selected legislators promoting children and family issues and creating a database of voters with a strong interest in voting for children."
,16,sig-crawler,sig-crawler,16,http://votesmart.org/interest-group/1975/national-defense-pac,National Defense PAC,http://nationaldefensepac.org/,,,http://nationaldefensepac.org/,"National Defense Political Action Committee [NationalDefensePAC] is dedicated to supporting the election of balanced-budget-committed Military Veterans to the U. S. Congress. We seek Military Veterans running for elected office who believe in limited government will rein in the out of control spending of Congress are committed to preserving and defending the US Constitution and will support the independence and freedom of the individual as outlined in the Bill of Rights. Our purpose is to support Military Veterans for election to Congress who are dedicated to promoting the Free Enterprise System that created the greatest economic engine in the history of Planet Earth who will CUT SPENDING and commit to the premise that raising taxes is not the answer to our spiraling national plunge towards bankruptcy. We sponsor candidates who will provide for a strong national defense and strong effective homeland security work tirelessly to ensure illegal aliens are prevented from crossing our national borders and are deported when they do and who will endorse the teaching of accurate US history and the Founding Fathers' core values in educational institutions."
,17,sig-crawler,sig-crawler,17,http://votesmart.org/interest-group/2060/western-organization-of-resource-councils,Western Organization of Resource Councils,http://www.worc.org/,,,http://www.worc.org/,"WORCs mission is to advance the vision of a democratic sustainable and just society through community action. WORC is committed to building sustainable environmental and economic communities that balance economic growth with the health of people and stewardship of their land water and air resources."
,18,sig-crawler,sig-crawler,18,http://votesmart.org/interest-group/1699/fleet-reserve-association,Fleet Reserve Association,http://www.fra.org,,,http://www.fra.org,FRA is a congressionally chartered non-profit organization that represents the interests of the Sea Service community before the U.S. Congress. The Association is named after the Navys program for personnel transferring to the Fleet Reserve or Fleet Marine Corps Reserve after 20 or more years of active duty but less than 30 years for retirement purposes and its membership is comprised of current and former enlisted members of the U.S. Navy Marine Corps and Coast Guard.
,19,sig-crawler,sig-crawler,19,http://votesmart.org/interest-group/1816/race-forward,Race Forward,http://www.raceforward.org/,,,http://www.raceforward.org/,"Race Forward's mission is to build awareness solutions and leadership for racial justice by generating transformative ideas information and experiences. We define racial justice as the systematic fair treatment of people of all races resulting in equitable opportunities and outcomes for all and we work to advance racial justice through media research and leadership development."
,20,sig-crawler,sig-crawler,20,http://votesmart.org/interest-group/922/national-parks-conservation-association,National Parks Conservation Association,http://www.npca.org/,,,http://www.npca.org/,"We (National Parks Conservation Association) believe that America's national parks and historical sites embody the American spirit. NPCA plays a crucial role in ensuring that these magnificent lands and landmarks are protected in perpetuity: We advocate for the national parks and the National Park Service; we educate decision makers and the public about the importance of preserving the parks; we help to convince members of Congress to uphold the laws that protect the parks and to support new legislation to address threats to the parks; we fight attempts to weaken these laws in the courts; and we assess the health of the parks and park management to better inform our advocacy work."
,21,sig-crawler,sig-crawler,21,http://votesmart.org/interest-group/38/american-congress-of-obstetricians-and-gynecologists,American Congress of Obstetricians and Gynecologists,http://www.acog.org,,,http://www.acog.org,"The American College of Obstetricians and Gynecologists (ACOG) is a membership organization dedicated to the advancement of women's health through education practice research and advocacy."
,22,sig-crawler,sig-crawler,22,http://votesmart.org/interest-group/735/international-association-of-machinists-and-aerospace-workers,International Association of Machinists and Aerospace Workers,http://www.goiam.org/,,,http://www.goiam.org/,"The International Association of Machinists and Aerospace Workers is active in more than 200 basic industries as defined by the US Department of Labor. It maintains one or more agreements with almost every major employer in the USA and Canada. The mission of the IAM Headquarters is to help individual members realize that potential. The departments of the IAM mirror the diversity of the members that form the union."
,23,sig-crawler,sig-crawler,23,http://votesmart.org/interest-group/1843/the-american-geriatrics-society,The American Geriatrics Society,http://www.americangeriatrics.org,,,http://www.americangeriatrics.org,The American Geriatrics Society (AGS) is a not-for-profit organization of over 6000 health professionals devoted to improving the health independence and quality of life of all older people. The Society provides leadership to healthcare professionals policy makers and the public by implementing and advocating for programs in patient care research professional and public education and public policy.
,24,sig-crawler,sig-crawler,24,http://votesmart.org/interest-group/1665/consumer-action,Consumer Action,http://www.consumer-action.org,,,http://www.consumer-action.org,Consumer Action is a non-profit membership-based organization that was founded in San Francisco in 1971. During its more than three decades Consumer Action has continued to serve consumers nationwide by advancing consumer rights referring consumers to complaint-handling agencies through our free hotline publishing educational materials in Chinese English Korean Spanish Vietnamese and other languages advocating for consumers in the media and before lawmakers and comparing prices on credit cards bank accounts and long distance services.
,25,sig-crawler,sig-crawler,25,http://votesmart.org/interest-group/57/born-free-usa,Born Free USA,http://www.bornfreeusa.org/,,,http://www.bornfreeusa.org/,Born Free USA is a national animal advocacy nonprofit 501(c)(3) organization contributions to which are tax-deductible. Our mission is to end the suffering of wild animals in captivity rescue individual animals in need protect wildlife  including highly endangered species  in their natural habitats and encourage compassionate conservation globally.
,26,sig-crawler,sig-crawler,26,http://votesmart.org/interest-group/545/national-gay-lesbian-task-force,National Gay & Lesbian Task Force,http://www.thetaskforce.org/,,,http://www.thetaskforce.org/,"Formed for the elimination of prejudice against persons based on their sexual orientation. Lobbies organizes educates and demonstrates for full civil rights and equality for lesbians and gay men."
,27,sig-crawler,sig-crawler,27,http://votesmart.org/interest-group/1673/association-of-community-organization-for-reform-now-acorn,Association of Community Organization for Reform Now (ACORN),http://www.acorn.org/,,,http://www.acorn.org/,This organization was dissolved in 2010. It's archives are kept here as a public service. "ACORN the Association of Community Organizations for Reform Now was the nation's largest community organization of low- and moderate-income families working together for social justice and stronger communities. From 1970 to its end in 2010 ACORN had grown to more than 175000 member families organized in 850 neighborhood chapters in 75 cities across the U.S. and in cities in Canada the Dominican Republic and Peru. ACORN's accomplishments include successful campaigns for better housing schools neighborhood safety health care job conditions and more. "
,28,sig-crawler,sig-crawler,28,http://votesmart.org/interest-group/517/parkinsons-action-network,Parkinsons Action Network,http://www.parkinsonsaction.org/,,,http://www.parkinsonsaction.org/,We are the unified voice of the Parkinsons community advocating for better treatments and a cure. In partnership with other Parkinsons organizations and our powerful grassroots network we educate the public and government leaders on better policies for research and an improved quality of life for people living with Parkinsons.
,29,sig-crawler,sig-crawler,29,http://votesmart.org/interest-group/329/citizens-for-global-solutions,Citizens for Global Solutions,http://www.globalsolutions.org/,,,http://www.globalsolutions.org/,"GlobalSolutions.org is a groundbreaking national online movement for Americans who want the United States to take a responsible and cooperative role in the world."
,30,sig-crawler,sig-crawler,30,http://votesmart.org/interest-group/1481/american-conservative-union,American Conservative Union,http://www.conservative.org,,,http://www.conservative.org,"Founded in 1964 the American Conservative Union (ACU) is the oldest and largest grassroots conservative organization in the nation. For more than forty years ACU has served as an umbrella organization harnessing the collective strength of conservative organizations fighting for Americans who are concerned with liberty personal responsibility traditional values and strong national defense. As Americas premier conservative voice ACU is the leading entity in providing conservative positions on issues to Congress the Executive Branch State Legislatures the media political candidates and the public."
,31,sig-crawler,sig-crawler,31,http://votesmart.org/interest-group/679/national-association-for-the-self-employed,National Association for the Self-Employed,http://www.nase.org,,,http://www.nase.org,"The National Association for the Self-Employed is the nation's leading resource for the self-employed and micro-businesses bringing a broad range of benefits to help entrepeneurs succeed and to drive the continual growth of this vital segment of the American economy. The NASE was founded in 1981 to provide day-to-day support benefits and consolidated buying power that traditionally had been available only to large corporations. Today the NASE represents hundreds of thousands of entrepreneurs and micro-businesses and is the largest nonprofit nonpartisan association of its kind in the United States."
,32,sig-crawler,sig-crawler,32,http://votesmart.org/interest-group/1420/armenian-national-committee-of-america,Armenian National Committee of America,http://anca.org/,,,http://anca.org/,"The Armenian National Committee of America (ANCA) is the largest and most influential Armenian American grassroots political organization. Working in coordination with a network of offices chapters and supporters throughout the United States and affiliated organizations around the world the ANCA actively advances the concerns of the Armenian American community on a broad range of issues."
,33,sig-crawler,sig-crawler,33,http://votesmart.org/interest-group/1860/women-employed,Women Employed,http://www.womenemployed.org,,,http://www.womenemployed.org,"Women Employed has one passion: to make life better for working women. We believe that all women deserve full and fair economic opportunities. That means better career options and higher pay more opportunities for training and education and strict enforcement of fair employment laws. "Women Employed is a leading national advocate for women's economic advancement. We analyze workplace issues educate policy makers and build support to improve opportunities and incomes."
,34,sig-crawler,sig-crawler,34,http://votesmart.org/interest-group/1015/national-education-association,National Education Association,http://www.nea.org,,,http://www.nea.org,"Our mission is to advocate for education professionals and to unite our members and the nation to fulfill the promise of public education to prepare every student to succeed in a diverse and interdependent world."
,35,sig-crawler,sig-crawler,35,http://votesmart.org/interest-group/591/retire-safe,Retire Safe,http://www.retiresafe.org,,,http://www.retiresafe.org,"RetireSafe.org is a grassroots action network promoting dynamic pro-growth solutions to Americas retirement security challenges. This grassroots network consists of all generations of citizens united in the belief that more choice and control over their retirement will produce prosperity for young and old. We seek retirement security through policies that encourage economic growth wealth creation and individual choice and control. Central to this is the ownership of retirement assets and the ability to pass those assets from generation to generation."
,36,sig-crawler,sig-crawler,36,http://votesmart.org/interest-group/351/national-ready-mixed-concrete-association,National Ready Mixed Concrete Association,http://www.nrmca.org,,,http://www.nrmca.org,"Our (National Ready Mixed Concrete Association) mission is to provide exceptional value for our members by responsibly representing and serving the entire ready mixed concrete through leadership promotion education and partnering to ensure ready mixed concrete is the building material of choice."
,37,sig-crawler,sig-crawler,37,http://votesmart.org/interest-group/988/californians-for-population-stabilization,Californians for Population Stabilization,http://www.capsweb.org/,,,http://www.capsweb.org/,"Californians for Population Stabilization (CAPS) works to formulate and advance policies and programs designed to stabilize the population of California at a level which will preserve a good quality of life for all Californians."
,38,sig-crawler,sig-crawler,38,http://votesmart.org/interest-group/1864/the-national-mining-association,The National Mining Association,http://www.nma.org/,,,http://www.nma.org/,The National Mining Association (NMA) is U.S. mining's advocate in Washington D.C. and beyond. NMA is the only national trade organization that represents the interests of mining before Congress the administration federal agencies the judiciary and the mediaproviding a clear voice for U.S. mining.NMAs mission is to build support for public policies that will help America fully and responsibly utilize its coal and mineral resources.
,39,sig-crawler,sig-crawler,39,http://votesmart.org/interest-group/1382/americans-for-immigration-control,Americans for Immigration Control,http://www.immigrationcontrol.com/,,,http://www.immigrationcontrol.com/,"Americans for Immigration Control is an American non-partisan grassroots activist organization with more than a quarter of a million members - citizens of all races creeds and colors. AIC is about stopping the millions of illegal aliens who sneak across our border from Mexico every year. AIC is about demanding that our federal government immediately use maximum manpower and support equipment to secure our nation from terrorists drug smugglers and illegals."
,40,sig-crawler,sig-crawler,40,http://votesmart.org/interest-group/101/council-for-a-livable-world,Council for a Livable World,http://www.clw.org/,,,http://www.clw.org/,"Council for a Livable World is a Washington D.C.-based non-profit non-partisan advocacy organization dedicated to reducing the danger of nuclear weapons and increasing national security. Our mission is to advocate for sensible national security policies and to help elect congressional candidates who support them."
,41,sig-crawler,sig-crawler,41,http://votesmart.org/interest-group/1221/sportsmens-and-animal-owners-voting-alliance,Sportsmen's and Animal Owners' Voting Alliance,http://saova.org/,,,http://saova.org/,"The Sportsmen and Animal Owners' Voting Alliance (SAOVA) is a nationwide nonpartisan group of volunteers seeking to elect politicians who will oppose the "Animal Rightist" (AR) threat to our rights as Americans. It is the only national group working to protect both sportsmen and animal owners natural allies in the legislative and political arenas. SAOVA's members hunt fish and own livestock dogs cats and other pets. We study political candidates in all states to identify those who understand and resist the AR threat as well as those who are in the pocket of the Animal Rightists."
