_input,_num,_widgetName,_source,_resultNumber,_pageUrl,name,url,url/_source,url/_title,url/_text,description
,163,sig-crawler,sig-crawler,163,http://votesmart.org/interest-group/131/the-population-institute,The Population Institute,http://www.populationinstitute.org/,,,http://www.populationinstitute.org/,PI's mission is to provide essential leadership to promote voluntary family planning and reproductive health services and increase awareness of the social economic and environmental consequences of rapid population growth. PI works actively to educate policymakers policy administrators the media and the general public about population issues. PI also recruits and trains tomorrow's population activists and national membership networks to address population issues. Our programs advance population education and activism. The Institute promotes both international and U.S. support for voluntary family planning programs.
,164,sig-crawler,sig-crawler,164,http://votesmart.org/interest-group/1791/the-childrens-health-fund,The Children's Health Fund,http://www.childrenshealthfund.org,,,http://www.childrenshealthfund.org,Children's Health Fund co-founded in 1987 by singer/songwriter Paul Simon and pediatrician/child advocate Irwin Redlener MD is committed to providing health care to the nation's most medically underserved children through: the development and support of innovative comprehensive primary care programs reducing the impact of public health crises on vulnerable children and promoting the health and well-being of all children
,165,sig-crawler,sig-crawler,165,http://votesmart.org/interest-group/1197/womens-action-for-new-directions-wand-and-will,Women's Action for New Directions (WAND) and WILL,http://www.wandpac.org/,,,http://www.wandpac.org/,To educate the public and opinion leaders about the need to reduce violence and militarism and redirect excessive military spending to unmet human and environmental needs.
,166,sig-crawler,sig-crawler,166,http://votesmart.org/interest-group/926/bread-for-the-world,Bread for the World,http://www.bread.org/,,,http://www.bread.org/,"Bread for the World is a collective Christian voice urging our nations decision makers to end hunger at home and abroad. By changing policies programs and conditions that allow hunger and poverty to persist we provide help and opportunity far beyond the communities in which we live."
,167,sig-crawler,sig-crawler,167,http://votesmart.org/interest-group/2345/americans-for-the-protection-of-children,Americans for the Protection of Children,http://www.americansprotect.com/,,,http://www.americansprotect.com/,"Americans for the Protection of Children is a Federal PAC that supports candidates that favor legislation that prevents gun violence. For too long the national conversation about gun violence has been one sided. APC is putting an end to that. Through APC doctors and nurses faith and civil rights leaders victims relatives and advocates policy experts and people that have worked on the front lines will shape the conversation about the role guns play in the daily life of America."
,168,sig-crawler,sig-crawler,168,http://votesmart.org/interest-group/1211/american-coalition-for-ethanol,American Coalition for Ethanol,http://www.ethanol.org,,,http://www.ethanol.org,"ACE was formed in 1988 to bring together a wide range of groups in support of ethanol. ACE unites agricultural producers commodity and farm organizations ethanol producers rural electric cooperatives businesses and individuals."
,169,sig-crawler,sig-crawler,169,http://votesmart.org/interest-group/1848/the-american-hellenic-educational-progressive-association,The American Hellenic Educational Progressive Association,http://www.ahepa.org,,,http://www.ahepa.org,The mission of the AHEPA Family is to promote Hellenism Education Philanthropy Civic Responsibility and Family and Individual Excellence.
,170,sig-crawler,sig-crawler,170,http://votesmart.org/interest-group/1268/united-auto-workers,United Auto Workers,http://www.uaw.org/,,,http://www.uaw.org/,"The International Union United Automobile Aerospace and Agricultural Implement Workers of America (UAW) is one of the largest and most diverse unions in North America with members in virtually every sector of the economy."
,171,sig-crawler,sig-crawler,171,http://votesmart.org/interest-group/2154/concerned-women-pac,Concerned Women PAC,http://www.cwpac.org/,,,http://www.cwpac.org/,CWPAC is committed to the values of religious freedom the sanctity of human life American sovereignty and traditional values. Every candidate we endorse must adhere to these values or go elsewhere for money.
,172,sig-crawler,sig-crawler,172,http://votesmart.org/interest-group/2411/muslim-public-affairs-council,Muslim Public Affairs Council,http://www.mpac.org/,,,http://www.mpac.org/,"OUR MISSION MPAC is an American institution which informs and shapes public opinion and policy by serving as a trusted resource to decision makers in government media and policy institutions. MPAC is also committed to developing leaders with the purpose of enhancing the political and civic participation of American Muslims. OUR VISION To establish a vibrant Muslim American community that will enrich American society through promoting the Islamic values of mercy justice peace human dignity freedom and equality for all."
,173,sig-crawler,sig-crawler,173,http://votesmart.org/interest-group/978/americans-for-democratic-action,Americans for Democratic Action,http://www.adaction.org,,,http://www.adaction.org,"Americans for Democratic Action has and will continue to be a forthright liberal voice of this nation. We work to advocate progressive stances on civil rights and liberties social and economic justice sensible foreign policy and sustainable environmental policy. The ADA will advance our agenda by maintaining an active and visible presence nationwide raising the level of debate on the side of the progressive movement and taking action on the national level. By working together with other like-minded organizations when we can and alone when we have to we will never shy away from issues or opposition."
,174,sig-crawler,sig-crawler,174,http://votesmart.org/interest-group/2174/american-association-for-the-advancement-of-science,American Association for the Advancement of Science,http://www.aaas.org/,,,http://www.aaas.org/,The American Association for the Advancement of Science "Triple A-S" (AAAS) is an international non-profit organization dedicated to advancing science around the world by serving as an educator leader spokesperson and professional association. In addition to organizing membership activities AAAS publishes the journal Science as well as many scientific newsletters books and reports and spearheads programs that raise the bar of understanding for science worldwide.
,175,sig-crawler,sig-crawler,175,http://votesmart.org/interest-group/2158/tea-party-express,Tea Party Express,http://www.teapartyexpress.org/,,,http://www.teapartyexpress.org/,Propelled by millions of Tea Party supporters across the country Tea Party Express has become the most aggressive and influential national Tea Party group in the political arena. We are committed to identifying and supporting conservative candidates and causes that will champion tea party values and return our country to the Constitutional principles that have made America the shining city on a hill. Tea Party Express is proud to stand for six simple principles: No more bailouts Reduce the size and intrusiveness of government Stop raising our taxes Repeal Obamacare Cease out-of-control spending Bring back American prosperity
,176,sig-crawler,sig-crawler,176,http://votesmart.org/interest-group/2196/the-network-for-public-education,The Network for Public Education,http://networkforpubliceducation.org,,,http://networkforpubliceducation.org,Our Mission: The Network for Public Education is an advocacy group whose goal is to fight to protect preserve and strengthen our public school system an essential institution in a democratic society. Our mission is to protect preserve promote and strengthen public schools and the education of current and future generations of students. We will accomplish this by networking groups and organizations focused on similar goals in states and districts throughout the nation share information about what works and what doesnt work in public education and endorse and rate candidates for office based on our principles and goals. More specifically we will support candidates who oppose high-stakes testing mass school closures the privatization of our public schools and the outsourcing of its core functions to for-profit corporations and we will support candidates who work for evidence-based reforms that will improve our schools and the education of our nations children.
,177,sig-crawler,sig-crawler,177,http://votesmart.org/interest-group/1704/big-cat-rescue,Big Cat Rescue,http://www.bigcatrescue.org,,,http://www.bigcatrescue.org,"Big Cat Rescue a non profit educational sanctuary is devoted to rescuing and providing a permanent home for exotic (i.e. wild not domestic) cats who have been abused abandoned bred to be pets retired from performing acts or saved from being slaughtered for fur coats and to educating the public about these animals and the issues facing them in captivity and in the wild."
,178,sig-crawler,sig-crawler,178,http://votesmart.org/interest-group/2336/young-womens-christian-association-ywca,Young Women's Christian Association (YWCA),http://www.ywca.org,,,http://www.ywca.org,"YWCA is dedicated to eliminating racism empowering women and promoting peace justice freedom and dignity for all."
,179,sig-crawler,sig-crawler,179,http://votesmart.org/interest-group/2221/j-street-pac,J Street PAC,http://jstreet.org/,,,http://jstreet.org/,
,180,sig-crawler,sig-crawler,180,http://votesmart.org/interest-group/1831/american-society-for-radiation-oncology,American Society for Radiation Oncology,http://www.astro.org/,,,http://www.astro.org/,"ASTRO is dedicated to improving patient care through education clinical practice advancement of science and advocacy."
,181,sig-crawler,sig-crawler,181,http://votesmart.org/interest-group/916/american-land-rights-association-formerly-league-of-private-property-voters,American Land Rights Association (formerly League of Private Property Voters),http://www.landrights.org,,,http://www.landrights.org,"LPPV is a coalition of more than 800 grassroots organizations that advocate the rights of property owners including farmers ranchers woodlot owners residents of rural communities owners of recreational property and inholders of private property located within and adjacent to federal lands. It also includes cabin permittees off-road vehicle owners equestrians snowmobilers hunters and recreational shooters and livestock grazers foresters and miners who make productive use of federal lands."
,182,sig-crawler,sig-crawler,182,http://votesmart.org/interest-group/1737/american-nurses-association,American Nurses Association,http://www.nursingworld.org/,,,http://www.nursingworld.org/,"The American Nurses Association (ANA) is the only full-service professional organization representing the interests of the nation's 2.9 million registered nurses (RNs) through its 51 constituent member nurses associations its 24 specialty nursing and workforce advocacy affiliate organizations that currently connect to ANA as affiliates. The ANA advances the nursing profession by fostering high standards of nursing practice promoting the rights of nurses in the workplace projecting a positive and realistic view of nursing and by lobbying the Congress and regulatory agencies on healthcare issues affecting nurses and the public."
,183,sig-crawler,sig-crawler,183,http://votesmart.org/interest-group/1065/latin-america-working-group,Latin America Working Group,http://www.lawg.org/,,,http://www.lawg.org/,"The Latin America Working Group is one of the nation's longest standing coalitions dedicated to foreign policy. The Latin America Working Group and its sister organization the Latin America Working Group Education Fund carry out the coalition's mission to encourage U.S. policies towards Latin America that promote human rights justice peace and sustainable development. LAWG promotes the interests of over 60 major religious humanitarian grassroots and policy organizations to decision makers in Washington."
,184,sig-crawler,sig-crawler,184,http://votesmart.org/interest-group/1404/drug-policy-alliance-network,Drug Policy Alliance Network,http://www.drugpolicy.org/,,,http://www.drugpolicy.org/,"DPA Network is the nation's leading organization working to end the war on drugs. We envision new drug policies based on science compassion health and human rights and a just society in which the fears prejudices and punitive prohibitions of today are no more."
,185,sig-crawler,sig-crawler,185,http://votesmart.org/interest-group/2332/jewish-women-international,Jewish Women International,http://jwi.org/,,,http://jwi.org/,"Inspired by our legacy of progressive womens leadership and guided by our Jewish values JWI works to ensure that all women and girls thrive in healthy relationships control their financial futures and realize the full potential of their personal strength."
,186,sig-crawler,sig-crawler,186,http://votesmart.org/interest-group/746/national-federation-of-federal-employees,National Federation of Federal Employees,http://www.nffe.org/,,,http://www.nffe.org/,The National Federation of Federal Employees (NFFE) is a national union representing approximately 110000 blue and white collar government workers across the United States.
,187,sig-crawler,sig-crawler,187,http://votesmart.org/interest-group/2368/citizenlink,CitizenLink,http://www.citizenlink.com/?skip_splash=1,,,http://www.citizenlink.com/?skip_splash=1,"CitizenLink is a family advocacy organization that inspires men and women to live out biblical citizenship that transforms culture. As a public policy partner of Focus on the Family we provide resources that equip citizens to make their voices heard on critical social policy issues involving the sanctity of human life the preservation of religious liberties and the well-being of the family as the building block of society. We help citizens understand and passionately engage in policy issues relevant to families from a foundation firmly established in a biblical worldview. We also encourage them to participate in the democratic process in order to forge a better future for our children and our culture."
,188,sig-crawler,sig-crawler,188,http://votesmart.org/interest-group/2171/food-policy-action,Food Policy Action,http://www.foodpolicyaction.org/,,,http://www.foodpolicyaction.org/,Our mission is to highlight the importance of food policy and to promote policies that support healthy diets reduce hunger at home and abroad improve food access and affordability uphold the rights and dignity of food and farm workers increase transparency improve public health reduce the risk of food-borne illness support local and regional food systems treat farm animals humanely and reduce the environmental impact of farming and food production. Food Policy Action promotes positive policies through education and publication of the National Food Policy Scorecard.
,189,sig-crawler,sig-crawler,189,http://votesmart.org/interest-group/2329/american-israel-public-affairs-committee,American Israel Public Affairs Committee,http://www.aipac.org/,,,http://www.aipac.org/,"The mission of AIPAC is to strengthen protect and promote the U.S.-Israel relationship in ways that enhance the security of Israel and the United States. AIPACs staff and citizen activists educate decision makers about the bonds that unite the United States and Israel and how it is in Americas best interest to help ensure that the Jewish state is safe strong and secure."
,190,sig-crawler,sig-crawler,190,http://votesmart.org/interest-group/799/the-leukemia-lymphoma-society,The Leukemia & Lymphoma Society,http://www.leukemia-lymphoma.org,,,http://www.leukemia-lymphoma.org,"The Leukemia & Lymphoma Society's mission is to cure leukemia lymphoma Hodgkin's disease and myeloma and to improve the quality of life of patients and their families. The Society has dedicated itself to being one of the top-rated voluntary health agencies in terms of dollars that directly fund our mission. "
,191,sig-crawler,sig-crawler,191,http://votesmart.org/interest-group/77/competitive-enterprise-institute,Competitive Enterprise Institute,http://www.cei.org/,,,http://www.cei.org/,"The Competitive Enterprise Institute is a non-profit public policy organization dedicated to advancing the principles of limited government free enterprise and individual liberty. Our mission is to promote both freedom and fairness by making good policy good politics. We make the uncompromising case for economic freedom because we believe it is essential for entrepreneurship innovation and prosperity to flourish."
,192,sig-crawler,sig-crawler,192,http://votesmart.org/interest-group/134/concerned-women-for-america,Concerned Women for America,http://www.cwfa.org,,,http://www.cwfa.org,Concerned Women for America (CWA) is the nation's largest public policy women's organization with a rich 30-year history of helping our members across the country bring Biblical principles into all levels of public policy. There's a cultural battle raging across this country and CWA is on the frontline protecting those values through prayer and action. We focus on six core issues: the family the sanctity of human life religious liberty education pornography and national sovereignty.
,193,sig-crawler,sig-crawler,193,http://votesmart.org/interest-group/2184/dapac,DAPAC,http://dapac.org/,,,http://dapac.org/,DAPAC was started in 2000 with the goal of creating a progressive Democratic Majority in Congress. We provide advice and logistical support for progressive Democrats running for Congress. We typically assist about a dozen progressive candidates every election cycle. We are the only group in the country that helps Progressive Democratic candidates with every aspect of their campaign. As a consequence we have a very high success rate in actually electing progressive Democrats to Congress.
,194,sig-crawler,sig-crawler,194,http://votesmart.org/interest-group/674/the-humane-society-of-the-united-states,The Humane Society of the United States,http://www.hsus.org,,,http://www.hsus.org,The Humane Society of the United States is the nation's largest and most effective animal protection organization. We help animals by advocating for better laws to protect animals; conducting campaigns to reform industries; providing animal rescue and emergency response; investigating cases of animal cruelty; and caring for animals through our sanctuaries and wildlife rehabilitation centers emergency shelters and clinics.
,195,sig-crawler,sig-crawler,195,http://votesmart.org/interest-group/1215/united-states-business-and-industry-council,United States Business and Industry Council,http://americaneconomicalert.org/,,,http://americaneconomicalert.org/,"The U.S. Business and Industry Council is a national organization of business owners and executives dedicated to making the U.S. domestic economy the world's leading engine of economic growth. The Councils mission is to expand our domestic economy with particular emphasis on our manufacturing processing and fabricating industries and through the resulting growth to extend a high standard of living to all Americans."
,196,sig-crawler,sig-crawler,196,http://votesmart.org/interest-group/1184/vote-hemp,Vote Hemp,http://www.votehemp.com/,,,http://www.votehemp.com/,"Vote Hemp is a national single-issue nonprofit organization dedicated to the acceptance of and free market for industrial hemp low-THC oilseed and fiber varieties of Cannabis and to changes in current law to allow U.S. farmers to grow the crop. Our ultimate goal is having hemp grown on a commercial scale in the U.S. once again and for the crop to be able to be processed here as well. We educate people on the issues surrounding hemp register voters and build coalitions to fulfill our mission."
,197,sig-crawler,sig-crawler,197,http://votesmart.org/interest-group/1456/american-veterans,American Veterans,http://www.amvets.org,,,http://www.amvets.org,"AMVETS MISSION STATEMENT: To enhance and safe­guard the enti­tle­ments for all Amer­i­can Vet­er­ans who have served hon­or­ably and to improve the qual­ity of life for them their fam­i­lies and the com­mu­ni­ties where they live through lead­er­ship advo­cacy and services."
,198,sig-crawler,sig-crawler,198,http://votesmart.org/interest-group/991/american-benefits-council,American Benefits Council,http://www.americanbenefitscouncil.org/,,,http://www.americanbenefitscouncil.org/,The American Benefits Council (the Council) is committed to being the preeminent advocate of employer-sponsored benefit programs in Washington D.C.
,199,sig-crawler,sig-crawler,199,http://votesmart.org/interest-group/812/peace-action-west,Peace Action West,http://www.peaceactionwest.org/,,,http://www.peaceactionwest.org/,"Peace Action West works for smarter American approaches to global problems. If we want to address problems like war poverty global warming terrorism -- the US needs to work together cooperatively with other nations. It also means overcoming the partisan politics and divisive rhetoric that often drown out alternatives to war. By getting regular Americans involved we build the political will to break that deadlock. We're the group behind the treaty that ended atmospheric nuclear testing we stopped President Bush's new nukes and now we're leading the charge for peaceful alternatives in Afghanistan. Our success comes from engaging average citizens like no other organization. Peace Action West's thousands of members make their voices count on matters that shape our world."
,200,sig-crawler,sig-crawler,200,http://votesmart.org/interest-group/1081/american-wilderness-coalition,American Wilderness Coalition,http://www.americanwilderness.org,,,http://www.americanwilderness.org,"The American Wilderness Coalition seeks to expand and protect our National Wilderness Preservation System by providing additive resources and advocacy assistance to the many individuals and organizations involved in campaigns to protect additional Wilderness Areas today."
,201,sig-crawler,sig-crawler,201,http://votesmart.org/interest-group/1542/american-immigration-lawyers-association,American Immigration Lawyers Association,http://www.aila.org,,,http://www.aila.org,"The American Immigration Lawyers Association is the national association of immigration lawyers established to promote justice advocate for fair and reasonable immigration law and policy advance the quality of immigration and nationality law and practice and enhance the professional development of its members."
,202,sig-crawler,sig-crawler,202,http://votesmart.org/interest-group/1912/republican-majority-campaign-pac,Republican Majority Campaign PAC,,,,,"The Republican Majority Campaign Political Action Committee (RMCPAC) is dedicated to restoring the Republican majority in Congress in 2010 by advancing an America First Platform (AFP) based upon positive ideals free markets and individual liberties."
,203,sig-crawler,sig-crawler,203,http://votesmart.org/interest-group/2033/league-of-southeastern-credit-unions,League of Southeastern Credit Unions,http://www.lscu.coop/index.php,,,http://www.lscu.coop/index.php,Representing 298 credit unions with $58 billion in assets and 6.3 million members the League of Southeastern Credit Unions (LSCU) is the trade association for Alabama and Florida credit unions.
,204,sig-crawler,sig-crawler,204,http://votesmart.org/interest-group/2338/log-cabin-republicans,Log Cabin Republicans,http://www.logcabin.org/,,,http://www.logcabin.org/,"The mission of Log Cabin Republicans shall advance the interests of the gay and lesbian community within the Republican Party of the United States of America. It shall assist in the development and enactment of policies affecting the gay and lesbian community within the Republican Party and by municipal state and federal governments. Its membership shall advocate and support candidates activities or initiatives which provide equal rights under law to persons who are gay or lesbian promote nondiscrimination against or harassment of persons who are gay or lesbian and encourage participation in the Republican Party by gay and lesbian Americans."
,205,sig-crawler,sig-crawler,205,http://votesmart.org/interest-group/766/american-library-association,American Library Association,http://www.ala.org,,,http://www.ala.org,The American Library Association (ALA) is the oldest and largest library association in the world providing association information news events and advocacy resources for members librarians and library users.
,206,sig-crawler,sig-crawler,206,http://votesmart.org/interest-group/1870/southern-alliance-for-clean-energy-action-fund,Southern Alliance for Clean Energy Action Fund,http://www.cleanenergyactionfund.org,,,http://www.cleanenergyactionfund.org,"Southern Alliance for Clean Energy Action Fund (SACE Action Fund) is the political arm of the Southern Alliance for Clean Energy. SACE Action Fund is a non-partisan non-profit (c4) organization striving to make global warming solutions a top priority for our region's elected leaders. As a legislative watchdog SACE Action Fund works within our region's conservation community to identify and highlight important energy and global warming-related legislation and votes in Congress with significant policy implications that will impact our air water economy and public health."
