_input,_num,_widgetName,_source,_resultNumber,_pageUrl,name,url,url/_source,url/_title,url/_text,description
,293,sig-crawler,sig-crawler,293,http://votesmart.org/interest-group/1256/human-rights-campaign,Human Rights Campaign,http://www.hrc.org,,,http://www.hrc.org,"The Human Rights Campaign is America's largest civil rights organization working to achieve lesbian gay bisexual and transgender equality. By inspiring and engaging all Americans HRC strives to end discrimination against LGBT citizens and realize a nation that achieves fundamental fairness and equality for all."
,294,sig-crawler,sig-crawler,294,http://votesmart.org/interest-group/1056/international-association-of-fire-fighters,International Association of Fire Fighters,http://www.iaff.org,,,http://www.iaff.org,"The International Association of Fire Fighters headquartered in Washington DC represents more than 295000 full-time professional fire fighters and paramedics who protect 85 percent of the nations population. More than 3100 affiliates and their members protect communities in every state in the United States and in Canada."
,295,sig-crawler,sig-crawler,295,http://votesmart.org/interest-group/1660/united-electrical-radio-and-machine-workers,United Electrical Radio and Machine Workers,http://www.ranknfile-ue.org,,,http://www.ranknfile-ue.org," 'UE' is the abbreviation for United Electrical Radio and Machine Workers of America a democratic national union representing some 35000 workers in a wide variety of manufacturing public sector and private non-profit sector jobs. UE is an independent union (not affiliated with the AFL-CIO) proud of its democratic structure and progressive policies."
,296,sig-crawler,sig-crawler,296,http://votesmart.org/interest-group/374/international-brotherhood-of-boilermakers,International Brotherhood of Boilermakers,http://www.boilermakers.org/,,,http://www.boilermakers.org/,The International Brotherhood of Boilermakers is a diverse union representing workers throughout the United States and Canada. Our members are employed in heavy industry shipbuilding manufacturing railroads cement mining and related industries. We construct and repair electric power plants refineries pulp and paper mills and steel mills. We build naval ships and commercial tankers repair locomotives make cement and mine coal gypsum and talc. We forge tools for industry and make consumer goods.
,297,sig-crawler,sig-crawler,297,http://votesmart.org/interest-group/149/service-employees-international-union-seiu,Service Employees International Union (SEIU),http://www.seiu.org,,,http://www.seiu.org,"Service Employees International Union's union political action program is independent of the Democrats or Republicans or any other party. Our goal is to keep the heat on all politicians to do what's right for working people. We're working together to: Strengthen Social Security and Medicare to guarantee the benefits we've been promised; Make quality health care affordable and available to everyone; Improve public services through better management and training for public employees not by bringing in outside profiteers with backdoor connections to politicians; and Protect workers' freedom to choose to have a voice at work by joining a union."
,298,sig-crawler,sig-crawler,298,http://votesmart.org/interest-group/846/people-for-the-american-way,People for the American Way,http://www.pfaw.org,,,http://www.pfaw.org,"People for the American Way is an energetic advocate for the values and institutions that sustain a diverse democratic society. Many of these are now threatened by the influence of the radical right and its allies who have risen to positions of political power. Our most fundamental rights and freedoms-and even our basic constitutional framework-are at risk. People for the American Way works in close collaboration with other leading national and state progressive organizations to mobilize Americans at this defining moment in our history."
,299,sig-crawler,sig-crawler,299,http://votesmart.org/interest-group/2321/asian-american-action-fund,Asian American Action Fund,http://www.aaa-fund.com/,,,http://www.aaa-fund.com/,"The AAA-Fund is a progressive political organization that is dedicated to empowering Asian Americans and Pacific Islanders across the United States. Through the AAA-Fund Asian Pacific Americans (APAs) from different ethnic groups and from all over the country work together to increase the voice of the APA community in local state and federal government. We do this by helping to elect APA and other political candidates who have a demonstrated commitment to the community and by engaging APAs in the political process."
,300,sig-crawler,sig-crawler,300,http://votesmart.org/interest-group/361/united-states-public-interest-research-group,United States Public Interest Research Group,http://www.uspirg.org,,,http://www.uspirg.org,U.S. PIRG is a consumer group that stands up to powerful interests whenever they threaten our health and safety our financial security or our right to fully participate in our democratic society.
,301,sig-crawler,sig-crawler,301,http://votesmart.org/interest-group/1931/newpolicyorg,NewPolicy.org,,,,,"The mission of NewPolicy.org is to work with citizens lawmakers and administration officials to implement longstanding American positions on the Arab-Israeli conflict in the interest of enhancing American security."
,302,sig-crawler,sig-crawler,302,http://votesmart.org/interest-group/1263/american-humane-association,American Humane Association,http://www.americanhumane.org,,,http://www.americanhumane.org,"To ensure the welfare wellness and well-being of children and animals and to unleash the full potential of the bond between humans and animals to the mutual benefit of both."
,303,sig-crawler,sig-crawler,303,http://votesmart.org/interest-group/1959/citizens-united-political-victory-fund,Citizens United Political Victory Fund,http://www.cupvf.org/,,,http://www.cupvf.org/,"Citizens United Political Victory Fund (CUPVF) is registered with the Federal Election Commission as a separate segregated fund of Citizens United. Its mission is to support conservative candidates running for federal office who share Citizens United's vision of reducing the size and scope of government lowering taxes cutting spending promoting traditional family values and winning the war on terror."
,304,sig-crawler,sig-crawler,304,http://votesmart.org/interest-group/205/state-pirgs-working-together,State PIRGs Working Together,,,,,"The State Public Interest Research Groups are an alliance of state-based citizen-funded organizations that advocate for the public interest. We uncover threats to public health and well-being and fight to end them using the time-tested tools of investigative research media exposes grassroots organizing advocacy and litigation. The state PIRGs' mission is to deliver persistent result-oriented activism that protects the environment encourages a fair marketplace for consumers and fosters responsive democratic government." This organization was dissolved. Its archives are kept here as a public service.
,305,sig-crawler,sig-crawler,305,http://votesmart.org/interest-group/1107/california-park-recreation-society,California Park & Recreation Society,http://www.cprs.org/,,,http://www.cprs.org/,"The California Park & Recreation Society provides career development networking resources and is the public advocate for California park and recreation professionals."
,306,sig-crawler,sig-crawler,306,http://votesmart.org/interest-group/1963/conservative-congress,Conservative Congress,,,,,"Today many call themselves Conservative. But when put to the test the facts don't always add up. It is the mission of Conservative Congress to evaluate every single candidate for the 2010 Congressional races that claims to be a Conservative to test their mettle to see if they really can call themselves Conservative candidates."
,307,sig-crawler,sig-crawler,307,http://votesmart.org/interest-group/1155/information-technology-industry-council,Information Technology Industry Council,http://www.itic.org/,,,http://www.itic.org/,The Information Technology Industry Council (ITI) is the premier advocacy and policy organization for the worlds leading innovation companies. We have earned the trust of the worlds most recognized technology brands to solve their most complex policy challenges.
,308,sig-crawler,sig-crawler,308,http://votesmart.org/interest-group/1790/gopusa,GOPUSA,http://www.gopusa.com,,,http://www.gopusa.com,GOPUSA strives to educate enlighten and engage conservatives through a host of features and services including news online discussions commentary and information.
,309,sig-crawler,sig-crawler,309,http://votesmart.org/interest-group/1717/computer-communications-industry-association,Computer & Communications Industry Association,http://www.ccianet.org/,,,http://www.ccianet.org/,"CCIA is a 40 year-old nonprofit membership organization for a wide range of companies in the computer Internet information technology and telecommunications industries represented by their senior executives. CCIA promotes open markets open systems open networks and full fair and open competition. CCIA serves as an additional and sometimes the only eyes ears and voice in Washington Brussels and Geneva for our members. Our goal is to proactively protect and promote their legitimate interests and to advance the broad common interests of our industries."
,310,sig-crawler,sig-crawler,310,http://votesmart.org/interest-group/7/nuclear-age-peace-foundation,Nuclear Age Peace Foundation,http://www.wagingpeace.org,,,http://www.wagingpeace.org,To educate and advocate for peace and a world free of nuclear weapons and to empower peace leaders.
,311,sig-crawler,sig-crawler,311,http://votesmart.org/interest-group/794/plumbing-heating-cooling-contractors-association,Plumbing-Heating-Cooling Contractors Association,http://www.phccweb.org,,,http://www.phccweb.org,The PHCC-National Association is the premiere organization for the p-h-c professional. Since 1883 PHCC has been the industry leader in promotion advancement education and training.
,312,sig-crawler,sig-crawler,312,http://votesmart.org/interest-group/1950/americans-for-legal-immigration,Americans for Legal Immigration,http://www.alipac.us/,,,http://www.alipac.us/,"ALIPAC supporters have a diverse range of opinions yet we are united in the belief that more should be done to reduce illegal immigration. ALIPAC supports those that legally immigrate but we DO NOT support any amnesty visa expansion or "Guest Worker" program designed to reward illegal aliens or legalize their presence in the US. We support a peaceful non racist rule of law approach to resolving illegal immigration."
,313,sig-crawler,sig-crawler,313,http://votesmart.org/interest-group/1956/iraq-veterans-for-congress,Iraq Veterans for Congress,http://www.iraqvetsforcongress.com/,,,http://www.iraqvetsforcongress.com/,AIVCs primary mission is to recruit fund and elect to Congress conservative Iraq and Afghanistan veterans. Many Republican veterans from other eras have requested AIVCs support. As a result we have taken on the secondary mission of supporting conservative Republican military veterans of all eras.
,314,sig-crawler,sig-crawler,314,http://votesmart.org/interest-group/872/national-taxpayers-union,National Taxpayers Union,http://www.ntu.org,,,http://www.ntu.org,"National Taxpayers Union (NTU) is America's independent non-partisan advocate for overburdened taxpayers. NTU mobilizes elected officials and the general public on behalf of tax relief and reform lower and less wasteful spending individual liberty and free enterprise. Founded in 1969 we work at all levels for the day when every taxpaying citizen's right to a limited government is among our nation's highest democratic principles."
,315,sig-crawler,sig-crawler,315,http://votesmart.org/interest-group/1863/american-association-of-retired-persons-aarp,American Association of Retired Persons (AARP),http://www.aarp.org,,,http://www.aarp.org,AARP is a nonprofit nonpartisan organization with a membership of more than 37 million that helps people turn their goals and dreams into real possibilities strengthens communities and fights for the issues that matter most to families such as healthcare employment security and retirement planning. We advocate for consumers in the marketplace by selecting products and services of high quality and value to carry the AARP name as well as help our members obtain discounts on a wide range of products travel and services.
,316,sig-crawler,sig-crawler,316,http://votesmart.org/interest-group/664/conservamerica,ConservAmerica,http://conservamerica.org/,,,http://conservamerica.org/,"ConservAmerica was founded under the name Republicans for Environmental Protection in 1995. Our mission is to restore the Republican Partys great conservation tradition which is grounded in the timeless conservative ethic of stewardship. We are working to restore conservation and environmental stewardship as fundamental elements of the Republican Partys vision for America."
,317,sig-crawler,sig-crawler,317,http://votesmart.org/interest-group/252/national-right-to-life-committee,National Right to Life Committee,http://www.nrlc.org/,,,http://www.nrlc.org/,"National Right to Life Committee (NRLC) is the nation's largest pro-life organization with 50 state affiliates and approximately 3000 local affiliates nationwide. NRLC works through legislation and education to protect those threatened by abortion infanticide euthanasia and assisted suicide."
,318,sig-crawler,sig-crawler,318,http://votesmart.org/interest-group/424/global-aids-alliance,Global AIDS Alliance,,,,,"The Global AIDS Alliance (GAA) is a nonprofit organization based in Washington D.C. Our mission is to galvanize the political will and financial resources needed to address the global AIDS crisis and reduce its impacts on poor countries that have been hardest hit by the pandemic." This organization was dissolved April 2011. Its archives are kept here as a public service. - Project Vote Smart
,319,sig-crawler,sig-crawler,319,http://votesmart.org/interest-group/2167/progressive-punch,Progressive Punch,http://www.progressivepunch.org/,,,http://www.progressivepunch.org/,ProgressivePunch is a non-partisan searchable database of Congressional voting records from a Progressive perspective. We show the performance of members within 160 different issue categories along with detailed vote descriptions.
,320,sig-crawler,sig-crawler,320,http://votesmart.org/interest-group/858/american-postal-workers-union,American Postal Workers Union,http://www.apwu.org,,,http://www.apwu.org,"The APWU is the world's largest postal union representing more than 220000 USPS employees and retirees and nearly 2000 private-sector mail workers. For more nearly four decades APWU has fought for dignity and respect on the job for the workers we represent as well as for decent pay and benefits and safe working conditions. As an AFL-CIO affiliate the APWU supports the struggle for social and economic justice for all working families."
,321,sig-crawler,sig-crawler,321,http://votesmart.org/interest-group/23/national-tax-limitation-committee,National Tax Limitation Committee,http://www.limittaxes.org/,,,http://www.limittaxes.org/,"The National Tax Limitation Committee (NTLC) was organized in 1975. Its mission has been: To provide national leadership to achieve the optimal size and functions of government and promote candidates and initiatives that support these goals."
,322,sig-crawler,sig-crawler,322,http://votesmart.org/interest-group/850/united-seniors-association,United Seniors Association,,,,,This organization was dissolved. Its archives are kept here as a public service. "United Seniors Association is a nonprofit nonpartisan organization founded in 1991. With a 1.5 million activists network nationwide USA is the leading group for citizen activists who want to cut taxes safeguard the Social Security Trust Fund and improve Social Security and Medicare for all generations."
,323,sig-crawler,sig-crawler,323,http://votesmart.org/interest-group/2059/national-organization-for-marriage,National Organization for Marriage,http://www.nationformarriage.org,,,http://www.nationformarriage.org,"The National Organization for Marriage (NOM) is a nonprofit organization with a mission to protect marriage and the faith communities that sustain it. Founded in 2007 in response to the growing need for an organized opposition to same-sex marriage in state legislatures NOM serves as a national resource for marriage-related initiatives at the state and local level."
,324,sig-crawler,sig-crawler,324,http://votesmart.org/interest-group/1985/numbersusa-americans-for-better-immigration,NumbersUSA [Americans for Better Immigration],http://www.numbersusa.com/,,,http://www.numbersusa.com/,"NumbersUSA Action is a non-profit non-partisan public policy organization that favors an environmentally sustainable and economically just America. It opposes efforts to use federal immigration policies to force mass U.S. population growth and to depress wages of vulnerable workers. NumbersUSA Action is pro-environment pro-worker pro-liberty and pro-immigrant. Activists in the NumbersUSA Action network are Americans of all races and include many immigrants and the spouses children and parents of immigrants. Those who need to refer to NumbersUSA Action with a short descriptive modifier should call it an 'immigration-reduction organization.'"
,325,sig-crawler,sig-crawler,325,http://votesmart.org/interest-group/1742/national-animal-interest-alliance-trust,National Animal Interest Alliance Trust,http://www.naiatrust.org,,,http://www.naiatrust.org,"The NAIA Trust is a nonprofit 501 (c) 4 organization established under the Internal Revenue Code to promote responsible animal care and ownership and reasonable laws policies and regulations to protect animals and the people who care for them. NAIA Trust provides information about animals and animal husbandry animals in education and entertainment scientific advances in animal and human medicine wildlife management hunting and fishing and pet ownership. It also sounds the alarm about threats to animals and to the human-animal bond caused by people who mistreat animals and by animal rights and environmental zealots. NAIA Trust counters the effects and misinformation of radicals in the animal rights and environmental movements through education legislation and the courts."
,326,sig-crawler,sig-crawler,326,http://votesmart.org/interest-group/1925/independence-caucus,Independence Caucus,http://www.icaucus.org/,,,http://www.icaucus.org/,"To find/elect fiscally sound candidates;help organize locally; educate people on current affairs; research money trails to every rep we can."
,327,sig-crawler,sig-crawler,327,http://votesmart.org/interest-group/54/national-association-for-college-admission-counseling,National Association for College Admission Counseling,http://www.nacacnet.org/,,,http://www.nacacnet.org/,"The National Association for College Admission Counseling (NACAC) founded in 1937 is an organization of more than 9000 professionals from around the world dedicated to serving students as they make choices about pursuing postsecondary education."
,328,sig-crawler,sig-crawler,328,http://votesmart.org/interest-group/199/american-muslims-for-jerusalem,American Muslims for Jerusalem,,,,,"American Muslims for Jerusalem is a not for profit organization incorporated in 1999 the organization is committed to the following objectives: To ensure that the concerns of the American Muslim community regarding Jerusalem and its environs are understood and respected in the formulation of U.S. policy. To present accurate and timely information to the mass media and other interested parties. To educate inform and mobilize the American Muslim community To raise the awareness of the American society in general and work for a just and comprehensive solution to the issue of Jerusalem.To cooperate with other organizations having similar objectives."
,329,sig-crawler,sig-crawler,329,http://votesmart.org/interest-group/1972/senate-conservatives-fund,Senate Conservatives Fund,http://senateconservatives.com/,,,http://senateconservatives.com/,SCF seeks to bring bold conservative leadership to Washington by supporting candidates who have the courage to fight for the timeless conservative principles of limited government strong national defense and traditional family values.
,330,sig-crawler,sig-crawler,330,http://votesmart.org/interest-group/164/american-association-of-university-women,American Association of University Women,http://www.aauw.org,,,http://www.aauw.org,The American Association of University Women (AAUW) is the nations leading voice promoting equity and education for women and girls. Since our founding in 1881 AAUW members have examined and taken positions on the fundamental issues of the day  educational social economic and political.
,331,sig-crawler,sig-crawler,331,http://votesmart.org/interest-group/2151/progressive-change-campaign-committee,Progressive Change Campaign Committee,http://boldprogressives.org/,,,http://boldprogressives.org/,"The Progressive Change Campaign Committee (PCCC) is an organization powered by our members that builds long-term progressive power. We elect bold candidates to Congress and mobilize around progressive policy priorities."
,332,sig-crawler,sig-crawler,332,http://votesmart.org/interest-group/318/campaign-for-a-color-blind-america,Campaign for a Color Blind America,,,,,"The Campaign for a Color-Blind America Legal Defense and Educational Foundation is a 501(c)(3) not-for-profit organization designed to challenge race-based public policies and educate the public about the injustices of racial preferences."
,333,sig-crawler,sig-crawler,333,http://votesmart.org/interest-group/240/national-committee-for-an-effective-congress,National Committee for an Effective Congress,http://www.NCEC.org,,,http://www.NCEC.org,"In 1948 Eleanor Roosevelt and her friends had an idea for an organization that would pool the resources of small contributors from across the country and spend those funds to help elect the most progressive candidates to the U.S. Senate and House. NCEC supports progressive candidates who fight for the issues we believe in like freedom of choice separation of church and state gun control equal rights and environmental protection."
,334,sig-crawler,sig-crawler,334,http://votesmart.org/interest-group/185/radical-middle,Radical Middle,http://www.radicalmiddle.com,,,http://www.radicalmiddle.com,"Radical Middle is one of the fastest-growing political newsletters in Washington D.C. But its not your usual Washington newsletter. It expresses an emerging new planetary political perspective and sensibility which we like to call 'radical middle."
,335,sig-crawler,sig-crawler,335,http://votesmart.org/interest-group/2350/house-conservatives-fund-republican-study-committee,House Conservatives Fund (Republican Study Committee),http://www.houseconservatives.com/,,,http://www.houseconservatives.com/,"The Republican Study Committee is a group of House Republicans organized for the purpose of advancing a conservative social and economic agenda in the House of Representatives. The Republican Study Committee is dedicated to a limited and Constitutional role for the federal government a strong national defense the protection of individual and property rights and the preservation of traditional family values. The group has played a major role in key policy areas including budget appropriations taxes education Social Security reform defense deregulation and general government reform. The Republican Study Committee is an independent research arm for Republicans. The RSC was founded to serve as an ideological rallying point where like-minded conservatives can coordinate their activities and stand on the basis of principle  where a minority of committed men and women without years of seniority or formal leadership positions can affect change. They can do it on their first day in Congress. They can do it by coming up with a sound policy idea and by articulating a powerful position in debate. They can do it by serving actively in the RSC and by making it their home and family during their tenure in Congress. The House Conservatives Fund (HCF) is a non-connected federal PAC supported by more than 100 fiscally and socially conservative Members of Congress who seek to elect the next generation of conservative leaders. Our mission is two-fold: 1. To maintain the conservative Republican majority in Congress. 2. To assure that principled conservatives are elected (and re-elected)."
,336,sig-crawler,sig-crawler,336,http://votesmart.org/interest-group/1738/the-american-college-of-physicians,The American College of Physicians,http://www.acponline.org,,,http://www.acponline.org,The American College of Physicians (ACP) is a national organization of internists  physician specialists who apply scientific knowledge and clinical expertise to the diagnosis treatment and compassionate care of adults across the spectrum from health to complex illness.
,337,sig-crawler,sig-crawler,337,http://votesmart.org/interest-group/644/doris-day-animal-league,Doris Day Animal League,http://www.ddal.org,,,http://www.ddal.org,"Doris Day Animal League is a nonprofit national citizen's lobbying organization working to improve the humane treatment of animals. In September 2006 we merged with the Humane Society of the United States. We work with the U.S. Congress government agencies and state and local officials to pass new laws and enforce existing laws that reduce the suffering of animals anywhere they are mistreated."
